{
  "backup_id": "20261020T031531Z",
  "completed_at": "2026-10-20T03:18:04Z",
  "errors": [],
  "healthchecks": {
    "daily": {
      "slug": "vps-backup-daily"
    },
    "monthly": {
      "slug": "vps-restore-monthly\r"
    },
    "weekly": {
      "slug": "vps-backup-weekly"
    }
  },
  "inventory_sha256": "96173699543be4b9c2eb23e8fc7e7fa9eacef2b998f5aeade83bc18012de8d8c",
  "job": "daily",
  "manifest_sha256": "8fd9be937a5bb825d4ecd97b220a21b614dd079a7ac7c80c2306de44150fedc0",
  "ports_listening": [
    {
      "address": "0.0.0.0",
      "port": 22,
      "protocol": "tcp"
    },
    {
      "address": "[::]",
      "port": 22,
      "protocol": "tcp"
    },
    {
      "address": "0.0.0.0",
      "port": 68,
      "protocol": "udp"
    },
    {
      "address": "0.0.0.0",
      "port": 80,
      "protocol": "tcp"
    },
    {
      "address": "[::]",
      "port": 80,
      "protocol": "tcp"
    },
    {
      "address": "0.0.0.0",
      "port": 443,
      "protocol": "tcp"
    },
    {
      "address": "[::]",
      "port": 443,
      "protocol": "tcp"
    },
    {
      "address": "*",
      "port": 2377,
      "protocol": "tcp"
    },
    {
      "address": "0.0.0.0",
      "port": 4789,
      "protocol": "udp"
    },
    {
      "address": "*",
      "port": 7000,
      "protocol": "tcp"
    },
    {
      "address": "*",
      "port": 7946,
      "protocol": "tcp"
    },
    {
      "address": "*",
      "port": 7946,
      "protocol": "udp"
    },
    {
      "address": "172.18.0.1",
      "port": 8000,
      "protocol": "tcp"
    },
    {
      "address": "*",
      "port": 8002,
      "protocol": "tcp"
    },
    {
      "address": "*",
      "port": 8300,
      "protocol": "tcp"
    },
    {
      "address": "*",
      "port": 8888,
      "protocol": "tcp"
    },
    {
      "address": "127.0.0.1",
      "port": 18789,
      "protocol": "tcp"
    },
    {
      "address": "127.0.0.1",
      "port": 18790,
      "protocol": "tcp"
    }
  ],
  "restic": {
    "repository_alias": "hetzner-storage-box",
    "snapshot_id": "b9dd887c",
    "stats": {
      "files_changed": 0,
      "files_new": 11,
      "files_unmodified": 0,
      "total_bytes": 770711
    },
    "tags": [
      "server=danlab-vps",
      "job=daily",
      "id=20261020T031531Z"
    ]
  },
  "restore_tests": {
    "monthly_cross_machine": {
      "details": "",
      "last_run": null,
      "status": "not-run"
    },
    "weekly_postgres": {
      "details": "",
      "last_run": null,
      "status": "not-run"
    }
  },
  "retention_policy": {
    "keep_daily": 14,
    "keep_monthly": 12,
    "keep_weekly": 8,
    "last_forget_status": "not-run"
  },
  "scaled_to_zero": [
    {
      "image": "sha256:fb5e1d2ce615f5e989515168f5a8957eb544697e09e02e94770502daefc36b30",
      "name": "contentos-core_contentos-core",
      "replicas": "0/0"
    },
    {
      "image": "contentos-health-monitor:latest",
      "name": "contentos-health_health-monitor",
      "replicas": "0/0"
    },
    {
      "image": "contentos-storage-guard:v8-20260817T1155Z",
      "name": "contentos-storage-guard_storage-guard",
      "replicas": "0/0"
    },
    {
      "image": "contentos-higgsfield-bridge:v8-20260818-sync-contract",
      "name": "contentos-video-producer_higgsfield-bridge",
      "replicas": "0/0"
    },
    {
      "image": "open-generative-ai:latest",
      "name": "open-generative-ai_open-generative-ai",
      "replicas": "0/1"
    }
  ],
  "server_id": "danlab-vps",
  "services": [
    {
      "image": "baserow/baserow:latest",
      "name": "baserow_baserow",
      "replicas": "1/1"
    },
    {
      "image": "searxng/searxng:latest",
      "name": "contentos-tools_searxng",
      "replicas": "1/1"
    },
    {
      "image": "contentos-vault-api:v8-20260818-pinned-a937085",
      "name": "contentos-vault_vault-api",
      "replicas": "1/1"
    },
    {
      "image": "fullmrktdept-captions:languages-20260914-r4",
      "name": "contentos-video-producer_captions-api",
      "replicas": "1/1"
    },
    {
      "image": "contentos-gemini-tts:v8-20260818-fallback-provenance-a937085",
      "name": "contentos-video-producer_gemini-tts",
      "replicas": "1/1"
    },
    {
      "image": "contentos-remotion:v9-20260827-minio-upload",
      "name": "contentos-video-producer_remotion",
      "replicas": "1/1"
    },
    {
      "image": "crm-stripe-receiver:latest",
      "name": "crm-stripe_crm_stripe_receiver",
      "replicas": "1/1"
    },
    {
      "image": "quay.io/minio/minio:latest",
      "name": "minio_minio",
      "replicas": "1/1"
    },
    {
      "image": "n8nio/n8n:2.36.7",
      "name": "n8nfila_n8n_editor",
      "replicas": "1/1"
    },
    {
      "image": "n8nio/n8n:2.36.7",
      "name": "n8nfila_n8n_webhook",
      "replicas": "1/1"
    },
    {
      "image": "n8nio/n8n:2.36.7",
      "name": "n8nfila_n8n_worker",
      "replicas": "1/1"
    },
    {
      "image": "postgres:17-alpine",
      "name": "n8npg17_postgres",
      "replicas": "1/1"
    },
    {
      "image": "pgvector/pgvector:pg16",
      "name": "pgvector_pgvector",
      "replicas": "1/1"
    },
    {
      "image": "portainer/agent:sts",
      "name": "portainer_agent",
      "replicas": "1/1"
    },
    {
      "image": "portainer/portainer-ce:sts",
      "name": "portainer_portainer",
      "replicas": "1/1"
    },
    {
      "image": "postgres:14",
      "name": "postgres_postgres",
      "replicas": "1/1"
    },
    {
      "image": "redis:latest",
      "name": "redis_redis",
      "replicas": "1/1"
    },
    {
      "image": "traefik:v2.11",
      "name": "traefik_traefik",
      "replicas": "1/1"
    }
  ],
  "started_at": "2026-10-20T03:15:31Z",
  "status": "pass",
  "version": 2,
  "volumes_backed_up": [],
  "volumes_considered": [
    "baserow_data",
    "contentos-tools_searxng-config",
    "minio_data",
    "portainer_data",
    "volume_swarm_certificates"
  ],
  "warnings": []
}
